<?xml version="1.0" encoding="UTF-8"?>
<animals xmlns="https://anyilanxin.com/animals"
  xmlns:xsi="http://www.w3.org/2001/XMLSchema-instance"
  xsi:schemaLocation="https://anyilanxin.com/animals ../../testmodel/Testmodel.xsd ">

  <bird id="tweety" gender="Female">
    <flightInstructor>daffy</flightInstructor>
    <flightPartnerRef>daisy</flightPartnerRef>
    <flightPartnerRef>plucky</flightPartnerRef>
  </bird>
  <bird id="daffy" gender="Male"/>
  <bird id="daisy" gender="Female"/>
  <bird id="plucky" gender="Male"/>
  <bird id="birdo" gender="Female"/>
</animals>
